{
  "$schema": "https://json-schema.org/draft/2020-12/schema",
  "$id": "https://wi-fight.local/schemas/canonical.schema.json",
  "title": "Canonical device security model",
  "description": "Vendor-neutral security model produced by the mapping engine for one device. Every leaf is a {value, state, evidence} triple. Every collection carries its own state so an unparsed list is never mistaken for an empty one. Field list source: packs/CLAUDE.md v1. Rename nothing; add freely. The x-absent annotation is the recommended absent-semantics for packs that map the field; a vendor pack may override it per mapping.",
  "type": "object",
  "additionalProperties": false,
  "required": ["schema_version", "device", "services", "auth", "session", "logging", "ntp", "snmp", "interfaces", "mgmt", "acl", "discovery"],
  "properties": {
    "schema_version": {"const": "1.0.0"},

    "device": {
      "type": "object", "additionalProperties": false,
      "required": ["hostname", "vendor", "os_family", "os_version", "model", "serial"],
      "properties": {
        "hostname":   {"$ref": "#/$defs/stringField", "description": "The name the device calls itself, shown in its prompt and used to identify it in reports.", "x-absent": "unknown"},
        "vendor":     {"$ref": "#/$defs/stringField", "description": "Which vendor pack recognised this configuration, for example Cisco IOS or Juniper Junos.", "x-absent": "unknown"},
        "os_family":  {"$ref": "#/$defs/stringField", "description": "The operating system family running on the device, such as IOS, NX-OS, Junos or FortiOS.", "x-absent": "unknown"},
        "os_version": {"$ref": "#/$defs/stringField", "description": "The software or firmware release the configuration was written for.", "x-absent": "unknown"},
        "model":      {"$ref": "#/$defs/stringField", "description": "The hardware platform or chassis model of the device.", "x-absent": "unknown"},
        "serial":     {"$ref": "#/$defs/stringField", "description": "The hardware serial number or processor board identifier of the device.", "x-absent": "unknown"}
      }
    },

    "services": {
      "type": "object", "additionalProperties": false,
      "required": ["ssh", "telnet", "http", "https"],
      "properties": {
        "ssh": {
          "type": "object", "additionalProperties": false,
          "required": ["enabled", "version", "timeout", "max_auth_tries"],
          "properties": {
            "enabled":        {"$ref": "#/$defs/boolField", "description": "Whether the device accepts encrypted remote command-line logins over Secure Shell.", "x-absent": "unknown"},
            "version":        {"$ref": "#/$defs/sshVersionField", "description": "Which SSH protocol version the server allows; version 1 is broken and only version 2 should be accepted.", "x-absent": "unknown"},
            "timeout":        {"$ref": "#/$defs/intField", "description": "How many seconds an SSH client has to finish logging in before the server drops the connection.", "x-absent": "default, scoped to OS version"},
            "max_auth_tries": {"$ref": "#/$defs/intField", "description": "How many wrong passwords an SSH client may try in one connection before it is disconnected.", "x-absent": "default, scoped to OS version"}
          }
        },
        "telnet": {
          "type": "object", "additionalProperties": false, "required": ["enabled"],
          "properties": {
            "enabled": {"$ref": "#/$defs/boolField", "description": "Whether the device accepts unencrypted cleartext remote logins over Telnet.", "x-absent": "unknown"}
          }
        },
        "http": {
          "type": "object", "additionalProperties": false, "required": ["enabled"],
          "properties": {
            "enabled": {"$ref": "#/$defs/boolField", "description": "Whether the built-in web management interface is reachable over plain unencrypted HTTP.", "x-absent": "default, scoped to OS version"}
          }
        },
        "https": {
          "type": "object", "additionalProperties": false, "required": ["enabled"],
          "properties": {
            "enabled": {"$ref": "#/$defs/boolField", "description": "Whether the built-in web management interface is reachable over encrypted HTTPS.", "x-absent": "default, scoped to OS version"}
          }
        }
      }
    },

    "auth": {
      "type": "object", "additionalProperties": false,
      "required": ["aaa", "enable_secret", "password_min_length", "login_banner", "local_users"],
      "properties": {
        "aaa": {
          "type": "object", "additionalProperties": false, "required": ["enabled"],
          "properties": {
            "enabled": {"$ref": "#/$defs/boolField", "description": "Whether centralised authentication, authorisation and accounting (AAA, for example RADIUS or TACACS+) is turned on.", "x-absent": "default, scoped to OS version"}
          }
        },
        "enable_secret": {
          "type": "object", "additionalProperties": false, "required": ["algorithm"],
          "properties": {
            "algorithm": {"$ref": "#/$defs/stringField", "description": "The hashing algorithm protecting the privileged-mode password, kept after redaction so weak hashes can be detected (for example type 5 MD5 versus type 9 scrypt).", "x-absent": "unknown"}
          }
        },
        "password_min_length": {"$ref": "#/$defs/intField", "description": "The shortest password the device will accept when a local password is set.", "x-absent": "unknown"},
        "login_banner": {
          "type": "object", "additionalProperties": false, "required": ["present"],
          "properties": {
            "present": {"$ref": "#/$defs/boolField", "description": "Whether a legal warning message is shown to anyone before they log in.", "x-absent": "default false"}
          }
        },
        "local_users": {
          "$ref": "#/$defs/collection",
          "description": "Accounts defined directly on the device rather than in a central directory.",
          "x-absent": "unknown",
          "properties": {
            "items": {
              "items": {
                "type": "object", "additionalProperties": false,
                "required": ["name", "privilege", "password_algorithm"],
                "properties": {
                  "name":               {"$ref": "#/$defs/stringField", "description": "The login name of a locally defined user account."},
                  "privilege":          {"$ref": "#/$defs/intField", "description": "How much the local account is allowed to do once logged in; higher means more administrative power."},
                  "password_algorithm": {"$ref": "#/$defs/stringField", "description": "The hashing or encryption scheme used to store this local account's password."}
                }
              }
            }
          }
        }
      }
    },

    "session": {
      "type": "object", "additionalProperties": false, "required": ["idle_timeout"],
      "properties": {
        "idle_timeout": {"$ref": "#/$defs/intField", "description": "How many seconds an inactive management session stays open before the device logs it out.", "x-absent": "default, scoped to OS version"}
      }
    },

    "logging": {
      "type": "object", "additionalProperties": false,
      "required": ["enabled", "level", "buffered_enabled", "servers"],
      "properties": {
        "enabled":          {"$ref": "#/$defs/boolField", "description": "Whether the device records system and security event messages at all.", "x-absent": "default, scoped to OS version"},
        "level":            {"$ref": "#/$defs/stringField", "description": "The minimum severity of event that gets recorded, such as informational, warnings or errors.", "x-absent": "default, scoped to OS version"},
        "buffered_enabled": {"$ref": "#/$defs/boolField", "description": "Whether event messages are kept in a local memory buffer on the device.", "x-absent": "default, scoped to OS version"},
        "servers":          {"$ref": "#/$defs/stringCollection", "description": "Remote syslog servers that event messages are sent to for central storage.", "x-absent": "unknown"}
      }
    },

    "ntp": {
      "type": "object", "additionalProperties": false, "required": ["authenticate", "servers"],
      "properties": {
        "authenticate": {"$ref": "#/$defs/boolField", "description": "Whether time updates must be cryptographically authenticated before the clock accepts them.", "x-absent": "default false"},
        "servers":      {"$ref": "#/$defs/stringCollection", "description": "Time servers the device synchronises its clock against.", "x-absent": "unknown"}
      }
    },

    "snmp": {
      "type": "object", "additionalProperties": false,
      "required": ["version", "traps_enabled", "communities"],
      "properties": {
        "version":       {"$ref": "#/$defs/stringField", "description": "Which SNMP monitoring protocol version is in use; v1 and v2c send passwords in cleartext, v3 can encrypt.", "x-absent": "unknown"},
        "traps_enabled": {"$ref": "#/$defs/boolField", "description": "Whether the device pushes unsolicited alert notifications to a monitoring station.", "x-absent": "unknown"},
        "communities": {
          "$ref": "#/$defs/collection",
          "description": "Shared community strings that act as passwords for SNMP v1/v2c monitoring access.",
          "x-absent": "unknown",
          "properties": {
            "items": {
              "items": {
                "type": "object", "additionalProperties": false,
                "required": ["string_redacted", "access"],
                "properties": {
                  "string_redacted": {"$ref": "#/$defs/stringField", "description": "The community string with its secret removed at ingest, kept only so entries can be told apart."},
                  "access":          {"$ref": "#/$defs/accessField", "description": "Whether this community can only read monitoring data or can also change configuration."}
                }
              }
            }
          }
        }
      }
    },

    "interfaces": {
      "$ref": "#/$defs/collection",
      "description": "Physical and logical network ports on the device, each with its own security settings.",
      "x-absent": "unknown",
      "properties": {
        "items": {
          "items": {
            "type": "object", "additionalProperties": false,
            "required": ["name", "shutdown", "description", "proxy_arp", "ip_redirects", "unreachables", "switchport_mode", "access_vlan"],
            "properties": {
              "name":            {"$ref": "#/$defs/stringField", "description": "The identifier of the port, such as GigabitEthernet0/1, taken from the enclosing configuration block."},
              "shutdown":        {"$ref": "#/$defs/boolField", "description": "Whether the port has been administratively disabled so it passes no traffic.", "x-absent": "default, scoped to OS version"},
              "description":     {"$ref": "#/$defs/stringField", "description": "Free-text label an administrator wrote on the port to say what it connects to.", "x-absent": "default null"},
              "proxy_arp":       {"$ref": "#/$defs/boolField", "description": "Whether the port answers address-resolution requests on behalf of other hosts, which can let traffic bypass intended routing.", "x-absent": "default, scoped to OS version"},
              "ip_redirects":    {"$ref": "#/$defs/boolField", "description": "Whether the port sends ICMP redirect messages telling hosts to use a different gateway.", "x-absent": "default, scoped to OS version"},
              "unreachables":    {"$ref": "#/$defs/boolField", "description": "Whether the port replies with ICMP destination-unreachable messages, which can help attackers map the network.", "x-absent": "default, scoped to OS version"},
              "switchport_mode": {"$ref": "#/$defs/stringField", "description": "Whether a switch port carries a single VLAN (access) or many VLANs (trunk), or negotiates it dynamically.", "x-absent": "default, scoped to OS version"},
              "access_vlan":     {"$ref": "#/$defs/intField", "description": "The VLAN number an access-mode switch port places its traffic in.", "x-absent": "default, scoped to OS version"}
            }
          }
        }
      }
    },

    "mgmt": {
      "type": "object", "additionalProperties": false, "required": ["vty_lines"],
      "properties": {
        "vty_lines": {
          "$ref": "#/$defs/collection",
          "description": "Virtual terminal lines that accept remote management logins.",
          "x-absent": "unknown",
          "properties": {
            "items": {
              "items": {
                "type": "object", "additionalProperties": false,
                "required": ["transport_input", "access_class", "exec_timeout"],
                "properties": {
                  "transport_input": {"$ref": "#/$defs/stringField", "description": "Which remote login protocols this terminal line accepts, for example SSH only, Telnet, or all."},
                  "access_class":    {"$ref": "#/$defs/stringField", "description": "The access list restricting which source addresses may log in on this terminal line."},
                  "exec_timeout":    {"$ref": "#/$defs/intField", "description": "How many seconds an idle remote login on this line stays open before it is disconnected."}
                }
              }
            }
          }
        }
      }
    },

    "acl": {
      "type": "object", "additionalProperties": false, "required": ["lists"],
      "properties": {
        "lists": {
          "$ref": "#/$defs/collection",
          "description": "Access control lists: named or numbered filters that permit or deny traffic.",
          "x-absent": "unknown",
          "properties": {
            "items": {
              "items": {
                "type": "object", "additionalProperties": false,
                "required": ["name", "entries"],
                "properties": {
                  "name": {"$ref": "#/$defs/stringField", "description": "The name or number identifying an access control list."},
                  "entries": {
                    "$ref": "#/$defs/collection",
                    "description": "The ordered filter statements inside one access control list.",
                    "properties": {
                      "items": {
                        "items": {
                          "type": "object", "additionalProperties": false,
                          "required": ["seq", "action"],
                          "properties": {
                            "seq":    {"$ref": "#/$defs/intField", "description": "The position of a filter statement within its access list; lower numbers are checked first."},
                            "action": {"$ref": "#/$defs/aclActionField", "description": "Whether matching traffic is allowed through (permit) or dropped (deny)."}
                          }
                        }
                      }
                    }
                  }
                }
              }
            }
          }
        }
      }
    },

    "discovery": {
      "type": "object", "additionalProperties": false, "required": ["cdp_enabled", "lldp_enabled"],
      "properties": {
        "cdp_enabled":  {"$ref": "#/$defs/boolField", "description": "Whether the device advertises its identity and software version to neighbours using Cisco Discovery Protocol.", "x-absent": "default, scoped to OS version"},
        "lldp_enabled": {"$ref": "#/$defs/boolField", "description": "Whether the device advertises its identity to neighbours using the vendor-neutral Link Layer Discovery Protocol.", "x-absent": "default, scoped to OS version"}
      }
    }
  },

  "$defs": {
    "evidence": {
      "type": "object", "additionalProperties": false,
      "required": ["line", "mapping_id", "pack_version"],
      "properties": {
        "line":         {"type": ["integer", "null"], "minimum": 1, "description": "1-based source line. Null only when state is defaulted (no line exists)."},
        "mapping_id":   {"type": "string", "minLength": 1},
        "pack_version": {"type": "string", "pattern": "^[a-z0-9_]+@\\d+\\.\\d+\\.\\d+$"}
      }
    },

    "triple": {
      "type": "object", "additionalProperties": false,
      "required": ["value", "state", "evidence"],
      "properties": {
        "value": true,
        "state": {"enum": ["mapped", "defaulted", "unknown"]},
        "evidence": {"oneOf": [{"type": "null"}, {"$ref": "#/$defs/evidence"}]}
      },
      "allOf": [
        {"if": {"properties": {"state": {"const": "unknown"}}},
         "then": {"properties": {"value": {"type": "null"}, "evidence": {"type": "null"}}}},
        {"if": {"properties": {"state": {"const": "mapped"}}},
         "then": {"properties": {"evidence": {"$ref": "#/$defs/evidence", "properties": {"line": {"type": "integer"}}}}}},
        {"if": {"properties": {"state": {"const": "defaulted"}}},
         "then": {"properties": {"evidence": {"$ref": "#/$defs/evidence", "properties": {"line": {"type": "null"}}}}}}
      ]
    },

    "boolField":      {"$ref": "#/$defs/triple", "properties": {"value": {"type": ["boolean", "null"]}}},
    "intField":       {"$ref": "#/$defs/triple", "properties": {"value": {"type": ["integer", "null"]}}},
    "stringField":    {"$ref": "#/$defs/triple", "properties": {"value": {"type": ["string", "null"]}}},
    "sshVersionField": {"$ref": "#/$defs/triple", "properties": {"value": {"enum": [1, 2, null]}}},
    "accessField":    {"$ref": "#/$defs/triple", "properties": {"value": {"enum": ["ro", "rw", null]}}},
    "aclActionField": {"$ref": "#/$defs/triple", "properties": {"value": {"enum": ["permit", "deny", null]}}},

    "collection": {
      "description": "A list plus its own provenance. state=unknown means the list was not parsed, and items MUST be empty; the evaluator returns NOT_DETERMINED for any quantifier over it instead of a vacuous PASS.",
      "type": "object", "additionalProperties": false,
      "required": ["state", "evidence", "items"],
      "properties": {
        "state": {"enum": ["mapped", "defaulted", "unknown"]},
        "evidence": {"oneOf": [{"type": "null"}, {"$ref": "#/$defs/evidence"}]},
        "items": {"type": "array"}
      },
      "allOf": [
        {"if": {"properties": {"state": {"const": "unknown"}}},
         "then": {"properties": {"items": {"maxItems": 0}, "evidence": {"type": "null"}}}}
      ]
    },

    "stringCollection": {
      "$ref": "#/$defs/collection",
      "properties": {"items": {"items": {"$ref": "#/$defs/stringField"}}}
    }
  }
}
